Reference,Content,Reaction,Comment,Share
101093,"tldr: what to do with my father? basically the situation is that my father has managed to, through his behaviour and actions (toxic, emotional blackmail, manipulative, etc), managed to alienate himself from the whole family. in fact I suspect he has borderline personality disorder. my mother is now doing her best to avoid seeing and interacting with him at all by coming back from work as late as possible, and is planning on divorce. not trying to be unfilial or anything, but I too am planning to move out after I get a job and have some income, because of the mental turmoil he keeps subjecting me to. seriously, because I'm the only child and he has no friends, he confides everything in me, even random crap like how my mother doesn't want to be physically intimate with him (which doesn't sound like something a son should even care about), and always coercing me to unlock my mother's phone so that he can read through her messages to see if she is cheating. and he always presents severe signs of stress and desperation which causes me a lot of stress at home too. therefore, as much as I don't want to leave him alone, I believe I have no choice because I should prioritize my mental health. all I hope for is for him to be able to lead a dignified life when he eventually lives alone. currently my plan is to help him to change to a job where he can be more active and make new friends (e.g. something like social worker? although I doubt it will work cos he's a very cynical and unsympathetic person). this can help improve his physical health and also give him a social net so that he doesn't have to turn to me for everything. but the problem with this approach is that he's uneducated (which limits the jobs he can apply to) and he is extremely reluctant to change. so now basically I have no other ideas about what to do with him. I'm not so keen on sending him to the old folks home cos he can currently still be independent and old folks home will burn my wallet quite badly. is there any use sending him for mental therapy? I feel like there may not be a point since there's a good chance he might not be receptive or he may simply just pass away before his problems are fixed. my father has honestly led a rather tough life, how do I prevent my father from living his final years full of bitterness and vengeance after we ""abandon"" him?-#101093: https://www.nuswhispers.com/confession/101093","['Sad: 3 people', 'Like: 1 person']",0 Comments,4 comments
101090,Just a rant. Is it true that guys discuss their female friends' bodies among themselves or is it just me being suay to have met this kind of friends.. One of my guy friends told me they talked among themselves about girls' bodies like who has the biggest cup size or nicest body or butt. Who knows what goes through their minds when they talk to us lol. And he still had the audacity to tell me about it. PS I immediately distanced myself and ended friendship with this friend because I don't need one who's a wolf in sheep's clothing.-#101090: https://www.nuswhispers.com/confession/101090,"['Haha: 28 people', 'Like: 21 people', 'Care: 8 people']",56 comments,2 shares
101089,I recently matched with a guy who lives at Pasir Ris while I live at Bukit Batok. I need advice from LDR couples. How can we make this LDR work? What are some midpoint locations/activities that we can do? How do you distribute travel time? How often do you meet? Thanks in advance!-#101089: https://www.nuswhispers.com/confession/101089,"['Haha: 214 people', 'Like: 50 people']",175 comments,56 shares
101088,"I have been feeling uneasy for the past few days . Everything was going super well or rather too well and suddenly , things turned a little cold .Normally I am already numb to it and just accept it that maybe its just that phase again .But a women’s intuition is never wrong , and I saw messages I never should have seen , known things that I should not know .Being lied to is one thing , feeling betrayed is one thing , but disappointed and the feeling of déjà vu all over again is just ….Not once but twice and having my worse fears relive again for the second time ..I love you but also I love you too much to be going through the same shit over and over again .Maybe it is really time to say goodbye because I really don't think I can do this over and over again . Feeling like shit and overthinking .-#101088: https://www.nuswhispers.com/confession/101088","['Like: 5 people', 'Sad: 2 people']",12 comments,2 shares
101086,"After reading many posts here, it's come to my attention that guys really don't know how to treat girls. We see many girls coming here hurt and lost because their boyfriends / husbands are insensitive and don't give them the attention they deserve, or are disloyal, or act childish and entitled. It seems that men around here really don't understand how women think and feel, or are just immature or inconsiderate. We almost don't see any posts that go the other way round, it's always women who are giving their all and getting hurt in return in relationships.All we're asking is some sensitivity to our needs. It's not that hard. Guys, you can do better. You should do better. We deserve it.-#101086: https://www.nuswhispers.com/confession/101086","['Haha: 20 people', 'Like: 16 people']",53 comments,5 shares
101084,"I have been in my current job for about 1.5 years and am planning to switch companies next year. Career progression wise seems stagnant as the department is relatively new and has no budget/headcount for permanent roles. 80% of the team is made up of outsourced employees who have been promised the prospect of a permanent role but being offered contract renewals time and again. Tbh, I’m only staying for the company name and experience that can help me to secure a good opportunity when I start job hunting at the end of this year. However, the past few weeks have been so crazy that I have the thought of just dropping my resignation immediately. Turnover rate has been an all time high with no replacements being hired. I have been doing the job of 3 people for the past few months without a salary increase. When they saw how well I was managing between jobs, it seemed like they forgot they were in the process of hiring a replacement. My colleagues who were fortunate enough to remain doing the 1 job they are paid for talked to me about evenly distributing the workload for the job function we have in common. It’s crazy how realistic some people can be and still talk about teamwork. Even if I’m not duly compensated for the additional work, it’d be nice to at least have supportive colleagues.-#101084: https://www.nuswhispers.com/confession/101084",['Like: 16 people'],0 Comments,5 comments
101073,"Hello everyone I’m just so sad and I need a place to vent and hopefully get some advices as well. It’s 12 am and I just ended work . I work in audit (I know everyone is going to say this is auditor life) but this is not even peak period for my company. I hate the work, the people and company. I am very friendly person with many friends outside but at work no one talks to me . I tried reaching out to different department colleagues but everyone seem to be happy talking to or going out for lunch among themselves.It’s been 9 months and I am the only new person it’s getting very difficult to be in my head for over 12 hrs. What do I do? Please give me some advices.-#101073: https://www.nuswhispers.com/confession/101073","['Like: 8 people', 'Care: 6 people', 'Sad: 6 people']",15 comments,2 shares
101071,"I only feel romantic but not family love. How? I know I’m wrong. I feel guilty and ashamed of myself for being this way but I don’t feel any love towards my family. I have been overseas for exchange, grad trip, and I didn’t feel sad when I said goodbye to my parents at all. I can’t relate to family love films like “hi mom” in 2021 about how mums love their daughters, and I didn’t feel anything when I watched “my sisters keeper” about a mum losing her daughter to death. Every time I suspect I am incapable of human emotions, I know I’m the complete opposite when it comes to romantic love. I bawled my eyes out watching several love movies. Even reading a short romance story sends tears flowing down my cheeks. I have cried listening to sappy romance songs and even cried at touching online proposals. I have cried over breakups but I never shed a tear when my family members passed away. I cry buckets when someone’s boyfriend dies (or just does something touching) in a movie but feel hard as stone when it comes to mother-child relationships and losses in movies and novels. I just intellectually know which part should be sad and logically know where I “should” cry (and I’m right, everyone else cries at family movies) but even if it happens to me right now, I don’t feel sad. I don’t feel anything remotely close to “love” when I see my mum no matter how much she sacrificed for me. My brain says I should love her but my heart doesn’t beat. Im not cold blooded, look at all my tears shed at all the romance. And yes my mum really loves me but the glitch in my brain stops me from loving her the same way I love my boyfriend no matter how hard I try. Are your feelings towards your mum and boyfriend the same? Are you supposed to love your mum in the same way as you love your boyfriend? Help!-#101071: https://www.nuswhispers.com/confession/101071","['Like: 4 people', 'Care: 1 person']",0 Comments,10 comments
101068,"TLDR Story: Invested 2 years my life in the girl, took the risk to confess to the person who was already in a relationship due to the girl constantly probing me on whether I liked her, got rejected after giving my answer, she requested to continue to be friends, I agreed. Still continues to go out with the close friend group and one on one sessions with the girl.It has been 8 months since the confession...now and then I would feel trapped and burdened....as I would need to keep silent and display a smile when going out with the group. Sometimes I will feel affected...when the girl talks about her bf in a group setting to my other friends as nothing happened, where it would cause me to feel that I would want to leave the group so I do not have to face all this anymore...However, I would suppress all these thoughts...as I cherish this group of friends and constantly remind myself to outweigh keeping this friendship vs being together with the girl.Would you give up a close friend group, because you missed a shot with someone you liked in the group and the person is already attached?-#101068: https://www.nuswhispers.com/confession/101068","['Like: 11 people', 'Haha: 1 person', 'Sad: 1 person']",16 comments,2 shares
101076,I hope to find a girl (70-75 kg+) to build relationships. Thank you-#101076: https://www.nuswhispers.com/confession/101076,"['Haha: 42 people', 'Like: 18 people']",40 comments,10 shares
101083,"At first glance, no one would be able to tell anything was wrong with me. I'm a very successful graduate student. Most people think quite highly of me. As much as possible I put on a brave face.The truth is, I'm falling apart everyday and I'm barely holding it all together. And I'm on my own. I have only a few friends with whom I'm close enough to seek support from. One of them only cares about talking about themselves and is constantly being extremely negative, which just makes things worse for me when I'm already barely keeping it together. Another one can be nice at times but is cold at other times. And I worry that I'll annoy this person too much if I keep bothering them so I try not to, especially since I've always gone to them with my problems in the past. They have their own problems to deal with, and they could be tired of me already.So I suppress everything because there's no one I can seek support from. I try to deal with everything myself, like an adult should. But I'm at my limits and I just don't know what else I can do. I'm trying very hard and often I wish I had just some simple support. I don't need anything special. Just simple words of encouragement occasionally, or just someone who genuinely cares enough to check in on how I'm doing once in a while. It's hard. I'm trying my best but it doesn't seem to be enough. I'm starting to feel passively suicidal, not so much in the sense of wanting to off myself since I don't want to make my family sad. But I'd be relieved if it ends. I'm not sure how much longer I can keep this up. I have to, but I just don't know how.-#101083: https://www.nuswhispers.com/confession/101083","['Like: 30 people', 'Care: 17 people']",27 comments,1 share
101079,Does anyone know where to buy large sized female shoes suitable for work? I’m most likely a EU42/43 usually I wear Nike Men’s of US9.5 -#101079: https://www.nuswhispers.com/confession/101079,['Like: 3 people'],0 Comments,4 comments
101081,"Just wanna get this off my chest. Had a team mate for a project in the last sem who was aloof and super capable. Really like that person alot but that person isnt interested in even being friends sadly. Guess its goodbye now since we are going separate ways. T, just feel so grateful to you for all the help and advices you've given me and i really like and look up to you a lot. Hope we can stay in contact and get closer. Wish I had the fortune of working with you longer. All the best in the new sem and your new job too. Im here if you ever need a friend. Hope i can meet someone like you again, who'll at least wanna be friends :')-#101081: https://www.nuswhispers.com/confession/101081","['Like: 9 people', 'Care: 2 people']",0 Comments,9 comments
101075,"Anyone been with a narcissistic person who tends to gaslight and manipulate you? My ex and I have been talking about getting back together but I realised that he doesn’t take responsibility his wrongdoings. 1. I always hear stuff like ‘it’s ok, I’m wrong, you’re right ok? you’re always right’ when I’m trying to communicate properly calmly.2. Because I’ve had a hookup phase, and I have a lifting account, he says stuff like ‘you’re just going to make friends with them because you want to f*** them. That’s all you do anyway.’ and he said he was conscious when he said these, he said it to purposely trigger me. 3. I told him that when we broke up, and he emotionally manipulated me by throwing the suicide card and pinning it on me, he doesn’t apologise for the hurt he caused. Instead, he says that he went suicidal cus I chose to break up.4. Ranted to my friend about our rs. He saw it and flipped. Said I shouldn’t tell anyone about what happens between us because rs is between your partner and you.5. He isn’t someone to reflect on his mistakes and when I communicate, he gets angry.He has nice qualities. He puts in effort for me, he is protective of me and he loves me. My mum loves him too. But it’s really draining. I’m not sure what to do.-#101075: https://www.nuswhispers.com/confession/101075","['Like: 15 people', 'Care: 7 people', 'Haha: 5 people']",36 comments,5 shares
101080,"I am a 176cm tall girl. It was really tough meeting sg guys whom are willing to accept someone of my height and I want to keep it this way to go for sg guys since I still want to keep myself real instead of faking myself with fake english and all. Eww. So recently, I fell in love with this guy I met online few months ago, we starting meeting up, do some dating & couple things together. He is really smart, good career, well built, and heads to yoga & gym along with me. But the height was an issue to him because he is a 168cm. He also told me that he belong to the smaller side. I told him it is fine, I will still treat him like a king, my own king. I understand from my sisters that girls need to constantly rub guy's ego, so I really tried everything to do that. But, last night on NY was a shocker to me. We did the deed and I am shocked that his thing is the size of my pinky finger!! Literally 3cm full erected & its not even thick at all. Although my pool of sg guys wasn't a lot, but from the data i gathered together with my sisters, sg guys have a max of up to 15cm or footlong. But hell.. why am I seeing this. So I want to ask the ladies here, what will you do if you face this? Should I break up with him given that I know I won't be satisfied with my sex life ever if I marry him one day?-#101080: https://www.nuswhispers.com/confession/101080","['Haha: 156 people', 'Like: 94 people']",262 comments,54 shares
101064,"I’m an influencer.. and my bf is a lawyer. I get jealous about him easily but deep down I really think it is a mix of possessiveness and envy. The girls in law (at least those who are the bf’s colleagues or course mates) look good, are financially+mentally independent and obviously very bright. Heavens really bless some people. How to compete and fight off attraction like that!? Lawyers also work very late hours.. I consider myself the understanding type but I still can’t help but wonder about the bf’s whereabouts. If I must be completely honest I do feel inferior in other areas to the other female lawyers around the bf since my relative strengths are mainly looks. Guessing maybe also the fact that the bf is a bit alpha mentality and clearly date down to protect ego hahah. Anyone dating lawyers or other high flying SOs with advice? ):-#101064: https://www.nuswhispers.com/confession/101064","['Like: 42 people', 'Haha: 26 people']",67 comments,12 shares
101062,"I can’t believe I have to say it now that we are already in 2022, but....guys/girls who value diamond rings (actually y’all can generalize that to rings in general) and see them as a symbol of everlasting love really turn me off. I say this with considerable hesitance because it is a view that’s gonna bring me much backlash.But think, do think (just a little) deeply about it. This whole hoohah over diamonds is much more a product of an outrageously successful advertising campaign lasting DECADES than any inherent quality these highly compressed lumps of carbon molecules bring therewith. Fussing over these inconsequential objects one leaves hanging on one’s finger, and worse, indirectly sustaining the atrocities going on in countries harbouring diamond mines, demonstrates unreal levels of ignorance and superficiality. Please guys, it is up to our generation now to break this terrible trend. Just ditch that fiance(e) of your who insists on a big fat glittering diamond ring so he/she can impress those equally ignorant.-#101062: https://www.nuswhispers.com/confession/101062","['Like: 44 people', 'Haha: 8 people']",50 comments,3 shares
101059,"I’m the OP of #101030.Just want to update that he does not hold any incriminating evidence against me and instead, I have some evidence on hand against him.As most of you have advised that its unlikely that he will make any repayments and since he is Singaporean (flight risk is minimal), I have decided to ensure he goes to jail, loses his job AND his family.(i) i will submit the evidence of his illegal activities to the police(ii) i will ensure his wife comes to know about everything he has done. (He lied that he was going through a divorce with his wife when we met on the dating app, but I have since found out that he is happily married)(iii) i will write to his company HR to ensure he loses his job(Yes, I made sure he got a job first before I lent him the money, so i know where he works)(iv) i will engage a debt collector to make his life hell over CNY.In the meantime, stay safe and happy everyone! -#101059: https://www.nuswhispers.com/confession/101059","['Like: 53 people', 'Haha: 12 people', 'Care: 4 people']",21 comments,4 shares
101058,"According to Zaobao news, Prof. Ben mentioned that marrying with his wife is his biggest achievement. Question: where to meet such a great wife? In church? Thanks.-#101058: https://www.nuswhispers.com/confession/101058","['Like: 29 people', 'Haha: 18 people']",27 comments,1 share
101051,"How do I deal with a husband who live in his own world?I married to my husband at 2018 and everything is good at the starting until he decided to run F&B business at 2020.He have no idea the amount of salt & sugar for the cooking but he make a decision to open the business with his friend(from decide to grand opening less than 6 months) but unlucky his friend also not a cook person so due to cannot see he fail I decide to help him and all the nightmare start. He is not a details person, so by-force I need to take care of the ordering part with supplier & train the staffs with daily operation running. And my job not end with this, after finished at outlet I still need to continue check my staff to cook at central kitchen. He is basically deal the apps & marketing & drive grab to cover monthly expenses. And he said business just starting so he only can pay me S$2500 a month for my work, after minus CPF left S$2k on hand. He never ask me pay for house but as in wife I will still buy my daughter needs & others stuffs.At Aug 2021, he keep bring me & my in law to do the house viewing. Then I ask him is it he wanted to buy a new house but he said just viewing only, because he use to see property video so I trust his word. We see a few condo and he ask my opinion, then 9/7/2021 he bring me see 1 of the condo at the east coast and the salesgirl told him the price will increase on the 12/7/2021. After viewing he seem like really get into and we sign the agreement of purchase at the midnight on 11/07/21. At the time our previous house haven get buyer and the new house only complete by 2023 so in very rush we sell house and move to rented condo. He is that kind of person who cannot listen to objection and I told him I haven ready to this big buy but he said no need me to pay, just help him pay maintenance fee is good enough. Then on Sept 2021, he not end his dream yet. He decided to open another outlet at heartland mall but all the shit still count on me. The most he deal with the renovation team but setup is done by me & my team. At this moment I already exhausted and my emotional is not so stable, I easy get angry and no more patience to deal with my surround things. After I setup done with new outlet he give me another ""SURPRISE"",he said I always ask for dog (which is before I help him in business & have my daughter) he get me a 2.5 month puppy on the Christmas. I already tell him I have no confident to take care of so many thing but he choose to ignore my word, and he roles in family just sit down watch TV & check on his phone, sleep & shit in the toilet. Not much interactive between him, my daughter & me plus the puppy. And we quarrel a lot for all this and he said I got anger management issue, and to proof him that he is wrong I book the psychology counselling session. After done the counselling session, the psychologist said I have no anger management issue just I overwork and I feel lost and insecure to all his decision. And my husband also not the kind of sweet talk person, since day 1 we married until now only have 1 Apple Watch as in present gift and if I ask for more he will said he already provide me house, wifi, Netflix & give me a lady boss title. He mean I no need work like last time need punch card and can be more flexible (which is really 24/7 no end kind), And he also said he provide everything so the S$2000 salary is enough for me to spend.But as in wife I know his stingy character so when the outlet no need me, I still will go do part time nurse to get extra income. Now I'm the dilemma should I ask for divorce since my effort is not been appreciated by him and the most important issue is I dunno what kind of surprise he will give me in future.-#101051: https://www.nuswhispers.com/confession/101051","['Like: 46 people', 'Haha: 26 people', 'Care: 14 people']",43 comments,24 shares
101047,"Hi parents, Have ever had the thoughts where you wished you never had a child. Or wished that your kid goes away with someone else to take care of them? Like forever? I've been feeling overwhelmed and I get very irritated, angry and frustrated. My husband helps a lot in taking care of the household and kid while inside of me just wanna cry frequently. Idk if I'm slipping into some kind of depression. Sometimes I can be positive and happy when my child is at home. But I drag the feeling of picking my lo back home. I'm always triggered by several things like non stop playing during meal times, taking hours to eat then refusal to put books and toys back to the original spots. And the most triggers I have are relatively new toys where some parts are deliberately misplaced and forgotten by LO when I already asked that it's placed back to the original place. I've bought many of the books and toys and it eeks me that within matter of mins, some parts get thrown around and it's a junkyard every night. Husband helps to keep but I've told him not to do it alone. It has to be with LO together so he learns to do it habitually. And then LO would refuse to bath, brush teeth, go pee, get changed etc. The mornings are my super angry moments daily when I try to prepare LO for school. LO would play immediately once awake or watch TV with his grandma. Then nagging to brush teeth is like me having to threaten to let his teeth rot or no breakfast if there's not enough time. I even meanly let him go to school without breakfast and he's ok. ????????????????????????I feel such a horrible parent and I've tried from gentle parenting to tiger parents and LO just don't respond or do as told. I wished I could just run away from these and back to the times where there's only my husband and I. I'm so sick of tired of feeling this way. ????????????-#101047: https://www.nuswhispers.com/confession/101047","['Care: 29 people', 'Like: 18 people', 'Sad: 5 people']",32 comments,8 shares
