Reference,Content,Reaction,Comment,Share
100759,"Stressed Healthcare WorkerFinally, I have decided to throw in the towel and call in a day after working for nearly a decade as an allied healthcare worker in a public hospital. It’s probably late but I think it’s never too late to change direction.Had I not been exposed to the rotten core of the upper management so early, had I still been sheltered from the fake reality of it all, had I not seen the painted façade of that upper echelons of management, I probably would still carry on in oblivion, believing whatever I sacrifice my life for has a greater meaning underneath. Alas, the hospital management is more interested in generating profits, in optics, in curated public images than in staff welfare. They’d rather prioritise retail space over staff welfare by taking out a pantry when constructing a certain new building.This is the core source of my disillusion. Fighting the fatigue of spending hours dispensing medications and serving patients feel less exhausting than the putting up a fake persona of efficiency and productivity to please the upper management. If I am the HR/ BOSSES in the hospital, I will do the following:(Instead of asking us to call counselling hotline and spamming our emails with brainwashed messages)1) Round up all the patient-fronting staff, ask them what other projects they have on hands and how many of these projects are done after work hours. Strike 95 per cent of those projects off. Allocate time for the remaining 5 percent during work hours. The other 95 percent passes to Operation staff who has no patient facing pressure.2) Employ more locums so full-time staff will have no weekends and PHs. We are bone and flesh humans that need to spend time with family and not machines to be exploited.3) Reduce unnecessary eLearnings, extraneous courses for staff: Data security, customer services etc… especially if those courses are conducted over the weekends. Basically, stop operating like an airline or a hotel business, when you are an essential service. You don’t need to pretend every patient is a high paying customer when 80 percent of them are on MediFund. It adds unnecessary stress to front facing staff. We prefer to be effective, polite and still be able to maintain our dignity as healthcare staff.4) Find out who are the nasty, micromanaging directors, HODs and banish them from their positions. Micromanagers are the worst. They complicate processes, add steps to simple workflows and create stress for everyone by lacking trust at every level.I know deep down, the only people who will read “Stressed Health Care Worker” Post are other stressed-out Healthcare workers. The only people that can understand these frustrating sentiments are other Healthcare workers. But I hope this post offers some solace to those colleagues because your sentiments are not unique. The fact that 1500 people left the first half of the year 2021 is a signal, a sign of an ongoing revolution, an upcoming rebellion. People are quiet, but they are not blind. If the management wants to stifle their voices, they will vote by their feet, by leaving…All the eyes that sit in that Ivory Tower are essentially nothing but eyes without the hands and feet labouring on the front line to sustain the Upper Management’s staggering bonuses. If you are reading this, Hospital Upper Management, can you ask yourself how many more months of bonuses do you reward yourself compared to the job grade lower than yours?#Hospitalstaff #stressed #frontline #Healthcareworker #pharmacy-#100759: https://www.nuswhispers.com/confession/100759","['Like: 185 people', 'Care: 71 people', 'Sad: 32 people']",24 comments,62 shares
100757,"How to best handle an annoying relative? I have this Auntie who started her nonsense when I was still dating. Put in toxic thoughts in me, ie. Asking if my then-bf was cheating when I told her that he's busy. Kept asking me to get married even though my then-bf haven't propose as he was poor & just started working. She knew but obviously don't care. Fast forward I got married, had a child. 6mths after giving birth, at our family dinner gathering in the mall, she touched my mummy tummy (slightly bulging belly) in front of everyone and commented that my tummy is big. 1 year later, she nagged at me every single time she saw me to have a 2nd child. Even when my husband was present, she would say it to me only. We had our plans but couldn't tell her as she doesn't try to listen and understand. So my ears had to suffer for years. And when we finally had our 2nd child (and opposite gender), I thought she will stop. (I am fine with any gender as long as baby is healthy. But knowing her, she would definitely say something like 'Try for a girl...a girl is 'better') And now she starts to nag at me to have a 3rd child every time we meet. Then at a mutual relative's wedding, she touched my mummy tummy again and in front of everyone, laughed at me again. I was pissed, my instant reaction was to touch her tummy back & pointing out that I have 2 children while she had only 1. (Not my best behavior but I felt she needed a mirror)Her biological child was single and didn't have any children yet.  So why focus on me? I can handle her naggings (pretending to be deaf or pregnant with 3rd child) but I can't handle the unexpected touch-tummy-and-jeer as politely. Definitely avoiding her as much as possible but I can't run away forever. Luckily my mother-in-law is not like her.-#100757: https://www.nuswhispers.com/confession/100757","['Like: 61 people', 'Haha: 21 people']",58 comments,8 shares
100765,"I’m so pissed that my husband bought a luxury car and wiped out his savings in the process, and it’s going to be a lot out of our pocket every month. We still have our joint savings that he didn’t touch, but I just felt like he was too impulsive. I asked him if he ever considered that he wouldn’t be able to pay off the rest, and he asked why I was such a pessimist. He explained that it’s something to reward himself, to push himself to work harder, and it’s probably the one and only chance in a long while before he buys something for himself since we are trying for a baby. To be fair to him, he is always very generous to his family and friends, and has the mindset that money can always be earned back. But I can’t stomach the fact that he willingly made such a huge purchase just like that, and the thing is he only drives probably less than 5 times a month as he doesn’t drive to work. I just feel like the money can be put to much better use like investments and other stuff???-#100765: https://www.nuswhispers.com/confession/100765","['Like: 111 people', 'Haha: 37 people', 'Sad: 13 people']",137 comments,24 shares
100755,"There is a quote saying that in life it is better to be useful than happy.I disagree. What's the point of being useful and unhappy? You would only die unhappy.Usefulness doesn't equate to happiness. Usefulness also doesn't equate to fulfillment. I have a very useful job. I am a teacher but I am not happy. I love and care for those around me. I am useful to them but I am not happy.I think being happy is more important than being useful. There is nothing worse at the end of life than to die unhappy regardless of how useful you were. There is nothing worse in the journey of life than making everyone around you happy while you yourself are unhappy.Whenever I am at my meaningful job teaching children, I think of becoming a pianist. That was my dream but I never perused it bcus it being a pianist is not useful in the eyes of society.I have alawys felt that quote is very poorly thought out. That quote blinds people and keep them in unhappy situations only to be useful.-#100755: https://www.nuswhispers.com/confession/100755","['Like: 52 people', 'Care: 11 people']",26 comments,7 shares
100766,I’m a data scientist. In this line bosses always commit that we can deliver. Recently changed job and it’s really stressful when my models give me shit results. 4% f1 score for DL models…wth ????????‍ Seriously dk how long can I do this even when good remuneration. At some point will get burned out and alr developed anxiety disorder.Should I switch to a more “chill” job in 2 years time? Definitely will get a haircut salary wise.-#100766: https://www.nuswhispers.com/confession/100766,"['Like: 24 people', 'Haha: 7 people', 'Sad: 4 people']",14 comments,2 shares
100754,"Seeking sincere advice... what to do when your sibling goes engages in ""wild"" activities? It was pure coincidence that I found out but at the age of 20, sibling was posting n*des on twitter and had c**doms in bag. I was so shocked because it felt like I had been living with an entirely different person all these while as the usual behavior at home was a goody two shoes to our mum. We had a big quarrel between us about him asking me to not control and just let him be and have not spoken much since 1 year ago, but I didn't expect to uncover that he seemed to have gone even more wild after being given free reins. Yet, he still remains the goody two shoes in front the mum and everytime I see it, it just feels so hypocritical to me. I know technically I have no rights to care since he is no longer a child. But is it really right to not care? Though he would probably not even care for whatever I say anyway (his personality has been that he is always deemed right and would never stop at getting what he wants; fun fact: he has also never apologized for anything before for as long as I can rmb) so I'm also at my wits end on how to stop him even if I want to... this dilemma on what is the right thing to do in such circumstance has been eating into me and troubling terribly...-#100754: https://www.nuswhispers.com/confession/100754","['Like: 23 people', 'Haha: 8 people', 'Wow: 3 people']",33 comments,4 shares
100753,"This RK incident is totally going the wrong way.If you look at her dopey eyes and face, she looks either totally severe lack of rest or she may be suffering from post natal depression or other forms of mental instability. Was her mental capacity checked and tested? We should be checking on her mental stability and agenda instead of firing people she pointed.If the boy cried wolf shouldnt the allegations be substantiated first before drilling everywolf the boy pinpointed? Afterall the boy is the one who lied?-#100753: https://www.nuswhispers.com/confession/100753","['Like: 56 people', 'Haha: 19 people']",57 comments,6 shares
100752,"In response to the long post on single male dating #100673, I have heard about the statistic although I am not very convinced about the interpretations of the findings. From the studies on tinder and hinge, the bottom 80% of men are competing for the bottom 22% of women and the top 78% of women are competing for the top 20% of men. However, these studies are based on “likes” and “swipes”, showing that it is based on a first impression and this impression may change. Not all romantic feelings are love at first sight, some feelings take time and effort to grow. Also, the demographic of people using dating sites are not representative of the entire population. The gender ratio on dating sites are skewed. In 2015, it was estimated that on okcupid, 68% of their users are male while 32% of the users are female. If we were put it into context with the percentage, assuming a population of 1000 of okcupid users, 680 would be men and 320 would be female. With the top 78% of women going for the top 20% of male, it would be around 250 women going for 136 men, the ratio of women after top 20% males to be 2:1. I think it make sense because remembering what I have learn in LSM1105 – Evolutionary Biology, the ratio of male to female is roughly 50:50 because if there is an advantage in having a specific gender, for example if there are plenty of females, it would be advantageous to have a male offspring. There will be more male offspring and the number of females offspring would decline, and the advantage of having a male disappears. The reverse also the same for females. Hence, if the percentage is truly so skewed against male, the gender ratio would be more heavily skewed. The ratio 2:1, seems likely because the risk of having a male offspring could end with double or no success. Of course, this is just my assumption so my calculations could very well be off.In terms of hypergamy, I agree with the selection pressure on height as majority of the couple have a taller male than female. However, in terms of education hypergamy, there have been studies that show that it has been reduced trend due to women achieving higher education. Studies found that there are fewer single women among women with high academic background. Also, there seem to be an assumption that the 20% top would be the same to everyone. Everyone is unique and have a unique preference when it comes to choosing a mate. Someone who is very attractive to one person may not be as attractive to another. In a sense, the top 20% suggests that these people have the highest trait. What about personal preference and compatibility? These are factors that affect the relationship as well. In fact, there seem to be empirical evidence showing that spouses tend to be similar in characteristics such as age, religion, education, race, physical characteristics, and personality. I am concern here because I am seeing a parallel with flat-earthers and anti-vax. I noticed that most of the comments agreeing to the posts are male which seem to be an echo chamber of sorts. When I search similar topics on forums, people who disagree and voice out alterative opinions are shut off with comments like “simps”. This is like how anti-vax and flat-earthers call other people “sheep” when they try to present scientific evidence. Anyway, I’m curious as to see what Prof Ben’s thoughts on this topic are as well.Link to studies:https://www.cairn-int.info/article-E_POPU_1504_0705...https://www.demographic-research.org/.../vol44/7/default.htmhttps://link.springer.com/article/10.1007/s42001-021-00132-w-#100752: https://www.nuswhispers.com/confession/100752","['Like: 11 people', 'Haha: 1 person']",7 comments,1 share
100749,"I was working as a marketing staff for about 6-7 months before the boss suddenly wants to remove the marketing department and make everyone do telesales instead. I'm not sure if I should even stay, because cold calling is not one of the things I signed up for, and it's definitely not anything that I want to do as a career. Before anyone says, just try doing telesales, I did try doing telesale. I can't hit the target because 1. I am the one who has to do the deliverables for the service that we are selling, this leads me to not have enough time to even call, and 2. I still have other duties to do. I feel tired and stuck :') any advices for me?-#100749: https://www.nuswhispers.com/confession/100749","['Like: 15 people', 'Sad: 3 people', 'Love: 1 person']",21 comments,2 shares
100748,"I have almost 2 years of work experience, graduated in May 2020. Yet, I'm still labelled as a fresh grad.. I went for a job interview recently. The hiring manager who interviewed labelled me as a fresh grad and ask why am I asking for such high pay. Is it common to be labelled as a fresh grad even after working at 2 years?..-#100748: https://www.nuswhispers.com/confession/100748","['Like: 58 people', 'Haha: 14 people', 'Sad: 8 people']",48 comments,6 shares
100746,"Many bad things have happened over the past 2 years and I'm feeling like I'm not me anymore. If I were a flower, I might be one that is slowly wiltering and fading out of people's sight.Nowadays, I feel nothing for the things that would normally make people happy even if it's short-lived. A job promotion, birthday celebration, nice food, etc - I don't find much joy in these things anymore. It's as if these things are just what they are, and there isn't much to be happy about. Tbh I don't really feel too sad either as I would already have expected bad stuff to befall upon me, so when it happens I'm just like ""oh, I knew it"".What's wrong and how can I make myself feel better? I don't really feel helpless or depressed, but I just don't really feel much emotions, maybe I'm feeling jaded with life...?-#100746: https://www.nuswhispers.com/confession/100746","['Like: 43 people', 'Care: 18 people']",28 comments,8 shares
100744,"Just getting this off my chest. Unsolicited advice welcome of course. I've known her for some years now. It was not an instant attraction but we hit it off in terms of personality and I'm sure she felt it too. Problem was I was attached back then. We got pretty close as colleagues. Then one day it felt like something short-circuited after we spontaneously did something couply together (innocent one k). Still not sure what happened till this day but I think she felt it at that moment too and pulled back from the friendship.Our friendship kind of went dead after that and it seemed like she was intentionally avoiding me for some time with super delayed responses over texts and the jios to go for tea break - which happened quite frequently before the short-circuit - stopped. Over the years, she revealed to me that she avoided guys and being with guys in 1-1 situations outside. Her reasons were understandable, so I pulled back too. My mental state at that point in time wasn't good as well (unrelated to her) so I removed her from my life because I didn't get a proper answer from her on what happened that day we short-circuited as friends but it 100% wasn't something that helped with my mental health. Actually maybe this short-circuit was all in my head. I don't know what really happened with her till this day but if anything, it made me like her even more (I know I know...)Over the past few years, life improved, I managed to get over her, got out of my then relationship for reasons unrelated to her, we attended some courses together as colleagues (I didn't jio, we just ended up taking the same courses), and somehow here we are again. She has also grown of course, and we're now both on a similar growth path unrelated to our main work. So we meet. And every time we meet, I definitely feel the chemistry there especially when I'm being myself around our group of friends. I never expected the feelings to come back, but life has a way of throwing a curve ball because now I'm actually really happy together with someone else and the same thing is happening. I know I won't be doing anything about this but I just can't believe it's happening again.-#100744: https://www.nuswhispers.com/confession/100744","['Like: 26 people', 'Care: 5 people']",29 comments,5 shares
100741,"I recently got a job as an events organizer and the company sent me for a half-day CPR+AED course with 3 other newbies. Near the end, the male instructor wanted to demonstrate how males can perform CPR and AED on females. I was 1 of only 3 girls present out of the 15 people in the class so he selected me. The CPR part was ok, he was v professional in showing how to do it while having minimal contact with my br**sts. But when it came to the AED, he stressed that it was very important to remove all clothing before applying the pads. Then to my horror, he pulled up my shirt and br*, completely revealing my br**sts to the class. I was frozen in shock as he showed them where the pads should be placed and invited them to look closer, which many of the male students did. I glanced at the other 2 girls and they looked equally horrified. He droned on about how ""modesty is worthless if the person is dead"", ""saving her life is the priority"", etc.While I agree with his statements, and concede that he did not touch me inappropriately, I still felt humiliated and wished he hadn't done it. My embarrassment intensified when I overheard my 3 male colleagues discussing me in lewd terms after the class.So my question is, is this worth quitting over? It took me 6 months of applications and interviews to land a job so I really don't want to, but I just feel miserable thinking about having to work with three creeps who have a twisted perception of me.-#100741: https://www.nuswhispers.com/confession/100741","['Like: 74 people', 'Wow: 67 people', 'Haha: 32 people']",151 comments,55 shares
100738,"Hi.. 24M here. I'm in a LDR with my partner for almost 1 year because she left overseas for university and I can't help being clingy to my partner. I know its very toxic in some situation. We have quarreled and argue over many times because of me being clingy. But I just can't change myself... Is there any way to stop being clingy? At times im not sure if i am being insecure or feel unloved thats why i get so clingy because my partner isn't someone who like texting and she stays in her girl friend house. So she rarely texts me and whenever we try to video call to spend time together, her friend would be in her room talking to her and she would just ignore me and only text me when i am getting annoyed and when I tell her that she always treat me like this we will just start quarreling again. Like... the only time we get to spend time together to talk about our day is through text or video call and when we are doing that she just spend her time talking to her friend instead for almost a year. Idk what i should do...We quarreled many times about needing the balance to spend time with one another and friends. After quarreling things will get better for only days before it revert back to norm again and we will just keep quarreling over and over again. She is graduating soon and will be coming back but I can't help but feel too hurt from all this going on but at the same time because of all this  I cant help wanting to cling onto her. I hope things will be back to normal when she is back because she clings onto me when we are together but just that during LDR she is like total opposite. LDR really sucks a lot its so mentally and emotionally draining...-#100738: https://www.nuswhispers.com/confession/100738","['Like: 18 people', 'Care: 6 people', 'Sad: 5 people']",18 comments,5 shares
100733,What theWent through and cleared all rounds of interview at a food delivery companyand just got told that they reduce the head count due to the new virus variantSo unprofessional for them to lead me on through the interviews and telling me this last minute-#100733: https://www.nuswhispers.com/confession/100733,"['Like: 15 people', 'Care: 4 people', 'Wow: 2 people']",0 Comments,10 comments
100732,"If any of you are thinking of becoming a nurse. Think twice. Because in nursing, you have a shitty job, shitty boss, shitty pay and terrible work life balance.-#100732: https://www.nuswhispers.com/confession/100732","['Like: 81 people', 'Sad: 25 people']",34 comments,4 shares
100726,"Gonna work in f&b as my first job and I'm completely clueless about employment rights and contracts. If I'm a full time staff, am I entitled to a contract, leave, and medical benefits and if the firm doesn't want to give it to me, it probably is a red flag right?? Then if there isn't a contract, I'm working based on trust which is quite shady ?? Also will part time need contract then ? To be honest, alot of my friends work part time without contract, is that against the law ? Someone help me please !-#100726: https://www.nuswhispers.com/confession/100726","['Like: 11 people', 'Care: 2 people']",0 Comments,17 comments
100728,"This post is for all alumnis out there. If theres a biggest regret(s) that you had during your uni times, what would it be? Perhaps we can share our views to help our juniors here to not miss out on stuffMine would be being too focused on studies and more of a solo mugger, lacking peer to peer interactions in my course. Regretted not staying hall or joining any activity group, and missing out on all the group bondings with people, and lack of making friends. Wished I had joined the NUS choir too.Its like when you are deep into the working life now that you will realise how hard is it make friends now at this age, out in the working world where office politics are plenty and your colleagues are never your true friends. My advice is to treasure whatever friends you can make in uni, especially your coursemates, because  you will never know when you will have their help in your industry-#100728: https://www.nuswhispers.com/confession/100728","['Like: 47 people', 'Care: 7 people']",14 comments,8 shares
