Reference,Content,Reaction,Comment,Share
100887,"#100865 / #100868: As a fellow VJC alum who lives in the US, I think it's a shame that David Rosal focused on superficial things to like about American girls.First, I can confidently say that the median Singaporean girl has better make-up and sartorial sense than the median American girl.The girls you see on social media and in the affluent parts of California aren't a central representation of the population. Even the staple look with Fjallraven backpack, crop top, Lululemon leggings, UGG boots and scrunchy is not what you'll see at a Walmart in suburban Pennsylvania. Furthermore, you have to normalize for climate: it's easier to dress well when the cold allows for layering.Instead, there's distinct personality traits that are steeped in American culture which gives American girls their unique charm.The median American girl is likely more open to conversation. She's also likely to eschew gender roles and ""be the man"" in the relationship. She's also more spontaneous, empathetic, selfless, confident, welcoming, and self-starting. She's also less judgmental and transactional, and values experiences over material needs to a greater extent. She's also more likely to adopt a more heterogenous set of positions and philosophy on life compared to her peers.Of course, these may not be ""your type"", and that's OK. But I feel these are much more significant reasons to prefer dating an American girl.Speaking of fashion authority, it's not like us Singaporean guys have much clout either. I mean, look at the VJC PE outfit.One day, I was a few minutes early for class, and as I was getting seated, the girl next to me slid a bemused glance towards my VJC PE shorts and quipped, ""Why are you always coming to class in boxers? Aren't you cold?"" I was too shy to look her in the eye, scan her and return the fashion critique. But in my peripheral vision, I could barely make out a smile beneath her honey blonde hair.The VJC PE shorts are so ugly, that I've been married to this girl for 6 years.I think it's OK to dress ugly.-#100887: https://www.nuswhispers.com/confession/100887","['Like: 43 people', 'Haha: 14 people']",6 comments,2 shares
100886,"Hi admins, please don’t delete this , it is really important to me! My GF and I have been together for a few years and I really love her. Both of us intend to have kids and I intend to marry her soon. But recently, something she did something that made me lose trust in her.  My GF and I have a really satisfying love life. As both of us are each other’s first s**ual partners and I always pull out, I have stopped using protection after my GF’s persuasion. Just a few days ago, we decided to do the dirty and as I was about to pull out, she wrapped her legs and pulled me into her, making me c*m right into her. I was actually confused on what happened as I was totally unprepared to a situation like this. I was furious and after we both cleaned up, I confronted her on what she did. She cried and claimed that she really love me a lot and wanted to be with me forever. As I am still angry and not in the mood to ague, I left her house and bought her a few pregnancy kits for her to use over the next few days. I did not talk to her about that accident since and she had since apologised for what she did. I really do love my GF, how can we improve our relationship ?-#100886: https://www.nuswhispers.com/confession/100886","['Haha: 94 people', 'Like: 66 people']",137 comments,48 shares
100885,"Can I see a therapist even though I don’t have any mental illness? I know I’m not depressed or have any kind of severe mental disorder but sometimes I have anxiety triggered by family or work and I’m not sure how to deal with it. I’m sure everyone feels this at times, nothing out of the ordinary. I just want someone to talk to sometimes.-#100885: https://www.nuswhispers.com/confession/100885",['Like: 53 people'],33 comments,5 shares
100881,"I’m in sales line and it’s majority female colleagues. Is it common to have colleagues being so bitchy???My previous line of work also falls under sales but I’ve never seen this kind of toxic work culture before. They are always thinking of ways to sabotage you, always taking behind your back and doing funny things. I just don’t get it?I’ve been here for half a year and this situation at work isn’t getting better. Before I joined, I heard that they’ve been bullying one girl and ganging up on her for at least 3 months. Just because they’re senior positions doesn’t mean they’ve above anyone else.-#100881: https://www.nuswhispers.com/confession/100881","['Like: 32 people', 'Sad: 7 people']",23 comments,3 shares
100877,"Just a rant.I guess most husbands are like that. They don’t want any problems. As long as things appear to be smooth they don’t care what happens behind the scenes. Even if baby cry during motn feed, also not their problem as long as they don’t need to be the one to wake up to feed. They continue to sleep.CL cook what do what, how they do is also not his problem. As long as get one CL to come in can already. Whether the wife got get the proper confinement is not his concern. Maid not clean, clothes, toilet not clean also not their problem. As long as got maid to do housework can already. Son also throw to maid to have breakfast, bath. Ownself sleep sleep, watch show at night.  Left with mummies the one to catch the slack. Wake up motn to watch over CL, wake up in the morning to breakfast with #1 and watch over everything in the house. If we sound out, we are thinking too much or too fussy. Feels tired and alone. Rant over. Jia you all mummies who face same as me. We are strong-#100877: https://www.nuswhispers.com/confession/100877","['Like: 112 people', 'Care: 51 people', 'Sad: 24 people']",103 comments,31 shares
100878,"I'm the person who had a really hard time being alone on New Years' eve last year.It had been tough coming to terms with what happened, going through legal procedures, packing up old things and just surviving. Thank you to the kind soul who offered to join your family and others in a similar situation for dinner, even though I didn't take you up on it.I haven't told my friends and colleagues about what I've been going through, but maybe they sensed it. They've been checking in with me since a few days ago and inviting me to their houses or out for meals almost every day for the remainder of the year.I'm writing here because I'm not sure if they know about what happened with my parents, and I don't want to burden them with this information if they didn't know.I just want to say thank you for your thoughts and company. I'm tearing up just thinking how I'm not going to spend the end of this year alone. The nights are still difficult but surviving has been much easier in all of your company.Thank you.-#100878: https://www.nuswhispers.com/confession/100878","['Like: 57 people', 'Care: 54 people']",10 comments,1 share
100880,"Hais.. Why NUSWhispers didnt post my last submission :((( please select this this time!I'm a 25 YO Female and currently dating a 20 YO. We have been dating since 2018. Our relationship is relatively stable and we seldom quarrel. He takes care of me and clearly cares for me a lot. I can feel that he is a very different type of guy compared to other guys on tinder or other dating apps just looking for s**. He feels like the one.However, we have yet discuss about our future together, and somehow everytime I try to bring it up, it would not be addressed. He is uncertain about our future but did say he wants to marry me. Nowadays, we will need to wait another 6 years for BTO.Any advice for a 25 YO Soul? Should I stay in this relationship?-#100880: https://www.nuswhispers.com/confession/100880","['Like: 42 people', 'Haha: 19 people', 'Care: 8 people']",63 comments,9 shares
100879,"To *o**r*ck from pfm, i am both elated (but sad) to hear that you have graduated this sem. Even though you are very warm and kind to everyone around you, i am sad that i lack the courage to approach and strike a conversation with you all these years. i wish you all the best and hope we can cross path again one day.-#100879: https://www.nuswhispers.com/confession/100879","['Like: 11 people', 'Care: 3 people']",0 Comments,16 comments
100875,"Hi hi, I am 38f this year with 2 young kids. The elder one will be entering primary school the year after next. I am currently fully employed and is having thoughts if I should become a stay at home mother when my kid enters primary. The responsibilities will then to guide them to have good character and also if they need help on homework, I can be there.  My spouse is ok with me giving up my job to do this and we are middle income family (11k combined). So it will be an obvious income loss if I stay at home.Would like to get a sensing from the younger community here .. based on your childhood, did having a stay home parent help you become a better/stronger person? Or if having both parents working, made you more independent/self confident etc.Thank you.-#100875: https://www.nuswhispers.com/confession/100875",['Like: 41 people'],59 comments,5 shares
100868,"Dear OP#100865Manly Guniang of #96681Please ask your fellow men to be more manly first. End of the day, some of us need to dress practically to rescue the Singaporean guys from cockroaches or lizards. Especially when they scream for us to help catch it.We also have to learn how to use power tools since a good number of guys scared to use. Whrrr big machine, lady can use omg I’m intimidated.Work with your own fellows first. #guniangpower #istickmyarmpitinyourface-#100868: https://www.nuswhispers.com/confession/100868","['Like: 19 people', 'Haha: 15 people']",8 comments,1 share
100861,"I am resigning but HR told me that because I didn't stay until 31st Jan, I don't get AWS at all, which was already paid out in December. This was not mentioned anywhere and even my contract says AWS is pro-rated. So actually it's not pro-rated la? I work for a stat board and the culture here is always that they are above the law.-#100861: https://www.nuswhispers.com/confession/100861","['Like: 66 people', 'Haha: 24 people', 'Wow: 12 people']",46 comments,15 shares
100865,"David Rosal's mistake was in the manner of his delivery, which is a shame because he was making fundamentally sound points. It is true that Singaporean girls rarely wear makeup, be it in school or at work. Tell that to any China/Japanese/Korean girl and she will be horrified; girls in these countries never leave the house without makeup, as they were correctly taught from young that it is an integral part of being feminine.Same goes with body hair. I think all local guys can relate to this PTSD: remember that horrifying moment when your female classmate in sec sch rose her arms to tie her hair and BAM! A blackforest of armpit hair right in your face. I even had a female friend in UNI who had hairy legs. Femininity is sadly a foreign concept in Singapore.This is why we - and David Rosal - should thank local influencers for their tireless efforts to change the social fabric. We laugh at their cringey insta captions and shame them for their sl**ty outfits, but have we ever stopped to think about the underlying message they are trying to promulgate? GIRLS SHOULD BE FEMININE. On behalf of Singaporean guys, I thank all local influencers for trying to make a difference, bit by bit, day by day, to the lupsup half of our population.-#100865: https://www.nuswhispers.com/confession/100865","['Haha: 46 people', 'Like: 30 people']",89 comments,16 shares
100856,"Please help a man out here. This is really awkward but I'm too shy to ask my friends about this. My drive has gone down a lot over the years. And even though my wife doesn't complain about it, I know her drive is much higher than mine. I feel bad not meeting her needs. I've tried many supplements like maca/tongkat etc but I don't feel like it's of much help. On top of that, we're staying apart in our own parents' house as we're still waiting for our bto. My wife tried staying over with me but circumstances wasn't in her favour as my parents changed 360 degrees on how they treated her after we got married. Before was nice but after she's seen as outsider blamed for every single thing. It's been very hard on her and she moved back to her parent's house last year. Because of this, we did the deed only few months once. It's been emotionally and mentally hard on her and I feel terrible as the husband as I'm not meeting all her needs. ???? I tried to book some staycations this year to make it up to her. But sadly my drivr isn't going to help when we got the opportunity but I just don't have the drive. Howwww? Help me please. Are there good supplements that really help?-#100856: https://www.nuswhispers.com/confession/100856","['Like: 50 people', 'Care: 12 people', 'Sad: 6 people']",69 comments,11 shares
100866,"Hi guys I need some love advice. I am a fresh grad (26M) and currently working in UK. I tried to date few angmos here , but there was a culture difference and I feel more comfortable dating Asians. The Singaporeans I met during my university days are going back home after graduation and hence it is hard to find someone to settle down with here. Also, the pressure to settle down is a lot since my parents will be asking about my love life , and then my ex sg classmates  are getting married next year too. I tried using coffee and bagel but none of the girls wants a long distance relationships. So I was wondering if there are any other dating apps out there that helps ? And how do I promote a long distance relationship if I try to put my location in singapore? Thanks-#100866: https://www.nuswhispers.com/confession/100866","['Like: 26 people', 'Haha: 7 people']",30 comments,1 share
100860,"How do you get out of a toxic relationship? I feel so tired and exhausted... it's been more than a year of roller coaster ups and downs, and every time I try to walk away, he pulls me back deeper into his web. When I'm around, he doesn't want me, but when I'm not, he wants me back. Even after so long and despite everything, I still love him... but I'm really so tired, I don't think I can hold out any longer. Deep down I know there's nothing left for me to stay for, that if he truly loved me he wouldn't keep choosing to hurt me over and over, over the same thing; that this hot and cold, back and forth, borders on emotional abuse. But how do I get out for real this time? Ignoring him, blocking him is of no use... he knows where I live and he'll either come wait here or constantly send things over. I don't understand why he comes running right back every time I try to move on, and why I always end up caving just because he's so persistent. Can someone please tell me how I can be stronger, how I can move on? I'm such a mess mentally and emotionally, and I really want to stop feeling this way.-#100860: https://www.nuswhispers.com/confession/100860","['Like: 21 people', 'Care: 13 people', 'Haha: 2 people']",37 comments,3 shares
100852,"I think I’ve reached the lowest point of my life. I recently found out that my father was cheating on my mother. Not only did he not feel any remorse over his action, he pushed the blame on me since I was the one who exposed his affair. He even mentioned that he was going to sue me for snooping through his phone and invading his privacy. Isn’t it ironic that evidence of adultery is needed in court and yet the means to acquire this evidence requires privacy invasion? I can’t believe a father would think about suing his own child over this when he was the one who was in the wrong. I’m honestly so drained from this and am really worried over our financial situation after this divorce. I think I’m panicking on the inside over the fact that my mom and my siblings might be homeless after all this… I’m starting to blame myself for exposing the truth to my mother since it was perhaps better for me to close one eye and live in ignorance.. life could have been simpler and happier that way.. I am really lost and have no idea what to do….-#100852: https://www.nuswhispers.com/confession/100852","['Like: 54 people', 'Care: 42 people', 'Sad: 31 people']",81 comments,24 shares
100850,"These days, I feel that people are taking relationships very lightly. Having so many cases of extra-marital affairs surfacing, fwb, cross partner exchanges etc, I cannot comprehend. I have been pretty depressed recently. So I cut contact with a guy, now for 4-5 months already. I had initiated it because I knew that the relationship was toxic right from the beginning. We already knew we were going nowhere, and eventually the day would come when we needed to go our separate ways. Yet each time, he reaches out to me, again and again I will unknowingly fall deeper for him. It came to a point where I knew it wasn't sustainable anymore. So I told him that we needed to stop so I can move on. Knowing that he knows the right words to say to make my heart turn back, I even blocked all channels of communication between us. Eventually, he still managed to reach out to me and drop a last msg, saying he accepts this, but he was still sad.Somewhere within me, I actually still hoped that he would come back and make me feel wanted. I wish he gave me the feeling that I would have some reason to return to him. But no. We ended via message, with me saying ""Let's just end here"". Between months, I still find myself missing him so much. I would uncontrollably contact him. When I messaged him, he seemed quite contented with his life. I realised I had always been the one holding on to things that don't belong to me, thinking that he would miss me as much as I missed him. I know I am silly. I should move on to find someone else I can rely on. But yet when guys approached me, I only wished that I could be back with him. Many times I had told myself to move on, but when I reached the stage of  ""getting to know each other"", I would feel exhausted and the thought that he is no longer with me will bring me sorrow. Why am I so enclosed?I question myself sometimes - perhaps if I don't love anyone, I would not get myself so upset. That's why when I look at people who played too much, I often wonder if they have been hurt badly before too?-#100850: https://www.nuswhispers.com/confession/100850","['Like: 54 people', 'Care: 25 people']",29 comments,10 shares
100855,"Posting this as a warning to job seekers.I was finding job 6 months ago through a recruiter, let's call them 'C'. They offered me a job and I accepted the offer. But I had a change of mind, and eventually told C that I'm not interested, and did not turn up at the client's place to sign the letter of appointment (LOA). Before that I did ask C for the LOA, but C had insisted not to give, saying its for audit compliance and does not carry any of the employment obligation between me and the recruiter.After I rejected the offer, C reiterated our email exchange and mentioned that there is a contractual obligation between us. In our contract, it was mentioned that I would only consider accepting any client's job offer if C could garner a minimum monthly basic salary of S$XXXX, which C had successfully done so based on my request. C had negotiated with this client without my knowledge or request, saying that there was 1 competing candidate and C had negotiated for the client to accept me.C is threatening legal proceedings against me for breach of contract if I do not pay them a compensation of 1 month in salary as per the contractual obligations, which had also stated that if I reneged an offer after acceptance, they could seek compensation from me. What should I do?-#100855: https://www.nuswhispers.com/confession/100855","['Like: 56 people', 'Haha: 9 people', 'Wow: 8 people']",62 comments,20 shares
100853,"Hi, i’m just wondering if it is relatively easy to get my leave of absence approved for one semester. I have had slight depression before entering university but i didn’t really fix it entirely and just sort of chugged through the first 2.5 years of Uni. And over this past 2 semesters, my mental health has declined and it’s really showing through my grades. I don’t really want to apply with a medical reason as that would mean revealing what i’m going through with the school…(afraid this would impact my employment or any other applications in future). Yet, i’m unsure of the school would be lenient in approving leave of absence under “personal reasons”-#100853: https://www.nuswhispers.com/confession/100853","['Like: 11 people', 'Care: 7 people']",0 Comments,9 comments
100848,"I’ve been struggling with graduate studies for awhile. While I was very happy to have been accepted into a master’s program, long-term depression and anxiety has prevented me from doing a lot of work. This year I ended up in the ER from an attempted suicide. Last month I found out my mother has fallen chronically ill. Despite all the stress, I still find myself in denial and am very hesitant to get help. Would it even matter? Would it even help? I feel like a failure. What should I do?-#100848: https://www.nuswhispers.com/confession/100848","['Care: 18 people', 'Like: 5 people', 'Sad: 5 people']",0 Comments,8 comments
100842,"Re: Guilty about not living with parents I recently gotten my new place. As I’m single, my parents decided to come over and their best intent to keep me company since there is more than sufficient space. I felt that my freedom is lost as I no longer have my whole space to myself. I don’t fancy things not in their place the way I like it , neither do I like the choice of music and tv program. I know I sound really mean and selfish as I was Ok when I was much younger and living at their place but when I grew up, I didn’t even want to share my space with them. To be honest , occasional visits are fine with me like 2-3 over night stays. I just cannot stand every day and every night and having to listen to their comments and opinions when I decide about my choices. It really piss me off when what I get decided gets vetoed off as a lousy decision, example, during renovation phase. It’s not that they have bad opinions but it’s just , I have grown up. I confided in 2 friends about this and one says it’s my place so I should have full decision and the other suppose I’m really not an easy person to live with. I do agree I’m not the best accommodating person, when it comes to living together. I just want to know: Am I really mean to think like this or is this normal?-#100842: https://www.nuswhispers.com/confession/100842","['Like: 52 people', 'Care: 14 people']",51 comments,6 shares
100841,"Hi guys, I need some genuine advice. Am a dude in my early 20s and in a relationship for abt 2 years. She is kind and I appreciate her character and our chemistry. But there is one thing that is bothering me greatly. Though I have not seen it, I am super bothered by the fact that my GF's b**bs seem smaller (super flat) compared to my chest (I gym quite a bit + naturally big chest ). I know we should not be superficial and ought to look beyond physical beauty and bodily imperfections but I am afraid that I will not be aroused (or even make her feel inadequate) when we engage in s*x in future. what should I do? should we talk about it? should we break up?-#100841: https://www.nuswhispers.com/confession/100841","['Haha: 81 people', 'Like: 44 people']",164 comments,32 shares
100837,"Hi all. Need some advice regarding a friend who is obsessed with me. Let's call him A. Been close friend with A for a really long time. However, A is starting to creep me out by copying every little thing I do, from the words I use in my speech to my personality (he originally had a personality that is a complete opposite from mine). He also pretends to like my hobbies and behaves like me. This is getting disturbing. Feels like A is stealing my identity. Have brought this up to A before but it is still happening. Would love to continue this friendship. What would you guys do??-#100837: https://www.nuswhispers.com/confession/100837","['Like: 9 people', 'Haha: 6 people', 'Wow: 1 person']",0 Comments,24 comments
