Reference,Content,Reaction,Comment,Share
100985,"To #100911I am in the same situation. For context, i was in a rlnship and had a bto with my ex but we broke up. Reading your post, i don't find you picky but more of looking for a husband material bf. In my case, my deal breaker was the emotional immaturity (of course both parties have faults as well). I was willing to stay by him and slowly guide him through but He wasn't willing to grow and bridge the gap, though i was. Even counselling cannot help. I spent countless nights in tears because i was so sad that we could have something great but it couldn't work out, it ended up affecting my work, my friendships etc. And plenty of sacrifices because he was not earning as much and i wanted to ensure that we have a sustainable future tgt. Until finally, under the encouragement of my friends, i took a step.Since the breakup, i no longer have to endure such hurt or pain and am actually excelling in my work again (previously my boss was worried as it was obvious my performance went down). I am getting a condo too on my own, when previously, i had to worry about him as well (since split ownership). Bobian, have to make lemonade out of lemons. Of course, like you, i worry about loneliness and being left on the shelf etc., but after this process, i realised, finding a correct partner is more important, regardless of age.Just want to let you know, plenty bash you for being picky or not staying by a man etc. Don't let that get to you. Being happy is the most important. My entire relationship looked like a fairytale on the surface but it was abusive emotionally and physically behind the scenes.For all those commenting on how she shld just tolerate or lower standards, let's be honest here. It is not a woman's job to make her man feel like a man. She is not a lifelong nanny to look after a man and guide him to grow or be better in whatever aspect or heal. And even if she does, lets face it, not every guy is willing to take that step. And yes, probably the good men are snapped up so we have to decide if we rather be alone and excel or deal with someone that potentially is a deadweight. I made my choice, jiayou! P.s. We can always go SDN tgt and check out the market!-#100985: https://www.nuswhispers.com/confession/100985",['Like: 190 people'],17 comments,20 shares
100978,"I was contracted as a full time employee at this small company, K, under a 6 months probation. During the probation, the metal shutters of K broke down and jam when I closed it at the end of the day. However prior the day, the shutter was showing sign of wear and tear which was made known to my boss, S, multiple times but he did not get it fixed. Also, considering that the first person to leave for the day is supposed to shut the shutter but failed to do so and she just left the office thus I closed the shutter that day instead. When the shutter jammed and broke down, I informed S about it. S gotten it fixed, but he blamed it on me for spoiling the shutter instead with excuses such as my negligence in failing to ensure that the shutter shuts properly and as I was the person who last touches it. (If the girl who left first that day closes it, why would I need to last touch the shutter and carry the blame since it’s a shared responsibility for all staff to ensure that doors and shuttler are closed if they leave first) S told me to compensate for the fixing fee which is over 4K plus, I did not agree as it was not stated in my contract that I will need to compensate for any damage equipment of the company and considering I am still under probation. However he printed out a letter and pressured me to sign on that day to agree to 100 being deducted from my monthly salary for 10 months, after signing the agreement he did not gave me a copy of it for my keepsake. With the fear of losing my job and hoping to pass the probation, I signed the agreement. However in my 4th month I was dismissed over a mere complain from customer saying that I rejected customer request after working hours as I had already closed the door and was a few steps away from office (when there are other staff who had yet to leave the office whom could had assisted the customer). In the end I failed on my probation and my last pay was deducted of 800. Would it be a losing battle if I tries to file a claim from MOM??-#100978: https://www.nuswhispers.com/confession/100978","['Like: 21 people', 'Angry: 21 people', 'Care: 7 people']",42 comments,3 shares
100977,"When did you decide whether to have children or not?I have been attached for close to two years now. Our relationship was built on the understanding that we'd get married eventually and start a family; my partner likes children very much. But for the past year, I have been considering if I actually don't want to be a parent after all. While I think it is meaningful to raise children and build a loving family, the sacrifices to be made are incredibly offputting. Having children requires so much commitment and responsibility, including financial cost, loss of personal time and freedom, the pressure to meet their emotional/developmental needs etc. As a female, there would also be physical changes and health risks I would have to deal with. People have told me that my views may change over time, especially when I get older. I also suspect that my reluctance to have children is because I haven't been able to do a lot of the things I want to do as a working adult yet, mainly travelling more and living independently. But the longer I drag this indecision out, the longer I'd be holding back my partner who could have used this time to find someone more compatible and start a family earlier. I haven't raised this with my partner seriously yet, because I want to be sure of my own position before engaging in a meaningful discussion with him. He is already clear on his stance and I don't expect to change his mind for my sake.Any thoughts please? Thanks in advance!-#100977: https://www.nuswhispers.com/confession/100977","['Like: 24 people', 'Care: 5 people']",31 comments,2 shares
100976,"F**k! I just cheated again.....I know that there are many out there who are strongly against cheating and would shame those cheaters out there. Unpopular sentiment here, but I really feel for my man Wang Leehom, Raeesah Khan, Ryan Tan, Sylvia Chan and so on... As a guy, as a young person, as a human being, I feel that it is only normal to make mistakes in life. Of course, committing a wrongdoing at the expense of another's happiness is bad and I am not condoning a cheater's, liar, or any criminal's offences. But if we take a step back and realise that all of us are bound to sin and fall off our path of righteousness one day, wouldn't we hope that there would be people, or at least someone out there who would not only forgive us, give us a chance but guide us back to the road towards dignity and normalcy once more? I hope these simple thoughts of mine would inspire others to not immediately jump on the bandwagon to cancel, shame and ridicule those who have done wrong in their lives. How about trying to take on a different perspective and imagine that the person who have sinned is your loved one, your partner,  your parent, your sibling, your friend, your idol, your teacher, your senior, your child, or even.... yourself? How would you react? Would you still post mean, nasty, sarcastic jokes and comments about this sinner? Would you continue to share their mistakes to people around you and turn them into the next meme and laughing stock? Or would you do your best to speak out on their behalf, give them the benefit of the doubt, or if the situation is rather unmendable, would you forgive them and give them a chance to climb back up onto their feet to prove themselves and live a life they desire again? Thanks for reading. Have a good day.-#100976: https://www.nuswhispers.com/confession/100976","['Haha: 36 people', 'Like: 27 people']",71 comments,8 shares
100974,"My current boyfriend (30 y/o) and i (27 y/o) have been together for more than 2 years and i started to grow tired of this relationship. We stay far away from each other (i live in west while he live in the central. ) Henceforth we only meet only 2 to 3 times per month. Sadly, I always have to travel all the way from jurong to his place just to meet him and go back home by myself. So far, he only drove me home twice in this two years. The first time is when he need to borrow my ipad so he drove me home to take it. The second time was when we went to jem for a midnight movie.Whenever we spend time together, he would be using his phone playing mobile games or checking his stocks the whole time.He always treats his friends and their girlfriends better than me. I always got excluded whenever his friends invite to play poker, sing k, mj and even their wedding. Oftentimes, he would last minute gave me lame excuses to cancel our dates.All my friends are encouraging me to break up and should not be wasting my time on him. Are there any ways i could improve the relationship or i really should break up with him? I have tried communicating with him about this but he always avoid the topic.-#100974: https://www.nuswhispers.com/confession/100974","['Like: 94 people', 'Care: 26 people', 'Sad: 18 people']",82 comments,12 shares
100981,"Hello NUS,May i ask those who have a full-time or midway bonded scholarship, upon graduation, are you numerated the same as market rate, higher or do they pay you lower to ""make up"" for the tuition expenses? Thank you for yr candid sharing!-#100981: https://www.nuswhispers.com/confession/100981",['No Reactions'],0 Comments,1 comment
100965,"I needed a place to rant. I have always envied friends with loving family because I felt my family is a huge chaos. My parents quarrel almost every other day, for the simplest thing you can think of. Their quarrels are so loud that I always felt my heart thumping fast and loud. I really hate myself for feeling this way, but I really hate my dad for his extremely toxic character. He is a big chauvinist, he always think he is right, if things didn’t go his way, he will be very angry and started shouting. He always feel the whole world owes him, and would express his unhappiness for people who are successful. Because of his character, he has not been working for the past 20 years, when he was in his early fifties. My elder sis was the one supporting the whole family expenses. Back then I was still in my primary school. I always recalled him scolding me when I switched on the lights at night to study. So, everyday I have to wake up very early, when he was still sleeping, on the bathroom light to study. I understand his concern was to save on electricity bill because his income had stopped. I just cannot understand why didn’t he put in effort to find a job then.My dad’s temper is so bad that his family members had not keep in touch with him ever since and he did not have any friends. Since young, he had always physically abuse my brother by punching him. My brother dreaded coming home and was a secondary school dropout. He learnt smoking, steals from people, and got easily triggered temper too. I always feel my dad had the biggest role to play in my brother going astray. Fast forward to today, dads temper had not improved a single bit, if any at all, it’s worsened. I really hate the way he talked to my mum, always finding faults at her and thinking he’s the right one.He is old now. Everytime I looked at him, tears will start to well up in my eyes. I really wanted so much to be filial to him, but I resent him so much. I feared him so much too. I know he is ageing, he lost weight, started having issues with eyes and legs. But everytime he shouts, it is still so loud and so vulgar. It’s as though the whole world owes him. I pray for the day when he starts being less toxic, be more grateful and with a better temper. So that his family will start caring for him.-#100965: https://www.nuswhispers.com/confession/100965","['Care: 45 people', 'Like: 30 people']",6 comments,2 shares
100964,"Sorry this is gonna be quite long. I need some advice and needed some ranting.So i have this bf, we met on dating apps and we're together for 2 years now. I have been staying with him at his place ever since. We have been breaking up and patching multiple of times, and his problem is that he got trust issue with me, so everywhere i go i have to take photo for him.(with who, where i am at), live location, He will also have my whatsapp web on his phone. Mainly because when we ""break up"" i would download dating apps and use it thinking that we ""break"" and could never patch back again every single time. I did meet new people from the datings apps here n there. But JUST MAINLY to eat, nothing else i swear on my life. But my bf he don't believe, therefore he thinks that I cheated on him etc etc. In between those ""break n patch"" i've move back to my own place.But now is that i've given birth to a baby with him. Things still happen. Firstly, his house is like a zoo. There's BIRDS, FISH and DOGS.The hygiene isn't there at the first place. Well when you think thats maybe ok. His dogs (2 dogs) are not properly trained. They pee and shit everywhere in the living room. The birds take over the balcony and kitchen. Could you imagine cooking with the birds? Everything in the kitchen is covered with cling wrap all etc. And cmon how worst could it be right? THE ONLY WINDOW IS AT THE BALCONY. Can you imagine the smell?Before i even give birth i'm staying in his room all day like IMH patient. Now my baby do basically the same things as me. WAIT before yall say what why didn't i talk to him all. I SPOKE TO HIM BEFORE. His dogs very smelly, train his dogs all wait baby come out already whr to learn to crawl walk all. I told him i wanna move away or at least get a rental or sm shit.He told me. ""Now i don't have the money. I also going enlist already. Cnnt wait meh?"" Ya enlist. He's 23. Say he don't have the time to shower his dogs all come back take care baby. Guess what. Dogs belongs to him his but his mom  taking care for him buying food for the dogs all. Wow. Nvm i told him i'll go find jobs, there's people willing to help me take care baby. He say he don't trust me therefore i'm still here in his house. Waiting for him to bring back money when he didn't even have the responsibility, he work as delivery and only 4hr a day. I tried moved away, but he ended up threatening me. He going suicide all, baby is his everything (his family rs not good), I don't want my baby noy being able to see his father. At that point of time, i still do have feelings for him and i don't wanna lose him so i went back. but when i'm preg he kept claiming that baby not his all. FORCED me to abort, didn't really contributed when i'm preg. But wants everything.Secondly, his mom has the very traditional thinking. So everything that i do is WRONG TO HER. I'm now a shm. I gave my baby pacifier, his mom started nagging ""why give pacifier, now baby so hard to take care. Last time i could just hug her and she'll sleep."" Cmon, your THIS SON DIDN'T YOU FEED HIM PACIFIER TOO? YOU'RE THE ONE TAKING CARE OR ME. Also she say don't speak things about baby infront of baby. Like for example ""baby very cute, she very guai, her hand very small."" HIS MOM ownself say those infront of my BABY. I mean this is my baby, i know my baby best and his mom would wants baby to sleep with her sometimes, then when baby gets fussy, she'll starts to indirectly says me. ""Why give pacifier, see drop cry drop cry. This baby very hard to take care, keep crying. Baby dw sleep i wan to sleep.""All nvm, i hand washed my clothes and baby's. Washing machine spoilt. When i see she's not drying any clothes. I went to soak my clothes going wash the next day, but instead. She wash her bedsheet and dry it. Till now my clothes has been soaking there for 4 days. I have been re-wearing my clothes for past 3 days.Thirdly, my bf, me and baby went out on xmas day to buy all of ours cny clothes, cause he going ns right. Guess what, he got me a shirt, i just take one from the shelves cause he were bout to pay for the clothes. If i didn't take any, he wouldn't probably rmb getting for me. He spents HOURS LOOKING at his clothes and baby's but mine? P.s. he didn't give me any money, i've talk to him before MANY times.The money that i've earned when i'm preg is all used up. Buying baby's crib all, diaper all. I tried getting from other's but his mom said very 'pangtan' but them taking it from his relative?!?? So? I really don't get it, but i couldn't say anything. At least baby could still have it. I'm slowly getting really exhausted, mentally tired, i really don't know what to do. For your information, i've been disowned by my own mom because of him. He's been sending message to my mom like ""How do you teach your daughter to become a slut.""And messages to me always ""No wonder your father deserve to die because of you."" My father passed way before i met him. I couldn't complete my studies and my dreams, i've got no one left. Friends all drifted because of him ya.For my baby, i really need some help i guess? I really don't know what to do anymore...Thanks for listening to my story -#100964: https://www.nuswhispers.com/confession/100964","['Care: 36 people', 'Like: 23 people', 'Sad: 23 people']",53 comments,17 shares
100961,I was in a 3 year long relationship. He was my first boyfriend and I loved him very much. I used to save up my pocket money so we could have nicer dates even though he would tell me to save it up instead. I am in a very happy relationship now and we’re even talking about getting married and having kids. I am very happy where I am now. But sometimes I can’t help but wonder how is my ex doing. I feel like it’s wrong for me to wonder. So I would like to ask everyone. Am I wrong to wonder and does this mean I’m not over my ex yet? Thank you for reading-#100961: https://www.nuswhispers.com/confession/100961,"['Like: 20 people', 'Haha: 2 people']",0 Comments,19 comments
100975,"Will you sleep with your manager? Nope, it is not what you think. I just started work at a new company for about 6 months. My manager is an attractive lady who is 6 years older than me. She is very assertive at work and really demands for us to commit time and effort to our task. However, after work she can be very pleasant to be with. A few of us had to work OT on Christmas to rush a report. After that, to reward us, she had suggested dinner and drinks. We had some alcohol and when it was time to leave, she suggested that I get a grab ride with her since it’s on the way. While in the car, she suggested that I could go up to her apartment for a second round, which I obliged, since it was still early.After a few cans of beer, she said I could sleep over if I wanted to. We ended up being intimate. Is this considered a relationship? If not, what does it mean? It seems so wrong to date your manager who is 6 years older, but I feel so attracted to her. Any advice?-#100975: https://www.nuswhispers.com/confession/100975","['Like: 136 people', 'Haha: 95 people', 'Wow: 24 people']",162 comments,49 shares
100973,"After giving up on myself repeatedly for 5 months, I have finally received Academic Probation. I feel so disappointed in myself, but I know I can only blame myself for messing everything up. I just feel so lonely and rejected by the whole world in this unfamiliar country. I have no friends here - even other Chinese students are so different from me. The situation is such that I can't settle down to do anything. I can only feel sorrow and have no motivation to study. Especially since nobody believes I have bipolar. I have no confidence to continue like this and complete the masters program...-#100973: https://www.nuswhispers.com/confession/100973","['Like: 13 people', 'Care: 13 people']",12 comments,1 share
100963,"I have a love hate relationship with my parents. I care about them a lot, just because they are my parents. But I can’t stand spending more than an hour with them, and I finally realised why it is so (after moving out and reflecting).My dad will just keep talking to me about religion and race (he is a racist) - which will piss me off. He won’t listen to any reason or facts.And my mom will just whine to me about random things. If I give my opinion or reply, they don’t care and mostly just cut me off so they can continue talking.Either that… or they pretend they don’t hear me. it’s not really a conversation. I’m like a fucking sponge . It’s suffocating.The only decent conversation i can have with them is over WhatsApp, where they don’t cut me off and actually reply to me.Is anyone’s parents like this?-#100963: https://www.nuswhispers.com/confession/100963","['Like: 36 people', 'Care: 7 people']",16 comments,1 share
100969,"Here I want to tell you one thing, that is, girls should not study science and engineering unless you are a strong woman. I will give an example of why girls shouldn't study science and engineering, for reference only!1. The learning process of science and engineering is very unfriendly to girls. First of all, we must all admit that science and engineering are filled with a lot of strong mathematics, strong physics, and strong science knowledge, and the learning intensity is high. Of course, high learning intensity does not completely affect girls, but strong logical thinking skills will defeat many girls! why? As we all know, men are far superior to women in logical thinking ability. This is an indisputable fact. Therefore, we rarely find well-known mathematician and physicists are men. There are very seldom women among mathematicians and physicist. At most, women are found among chemists and biologists who are weak in logical thinking.2.The future job prospects of science and engineering are not friendly to girls. Except for science teachers, most of the employment prospects of science and engineering are given priority to boys, such as mechanics, electronics, civil engineering, and other majors are given priority to most men. They all refuse to recruit girls! At this time, you may ask that girls who are physically strong are not dominant, but majors such as IT, telecommunications and other majors who are mentally based are not always patriarchal! The answer is that it may disappoint you. Girls are equally discriminated against in these majors. Take the IT major as an example. The golden working age of a code farmer is probably between 25-35 years old. Why? One word ""tired"". Because I have to ""996"" and ""007"" at every turn, it's really tiring. Even if a person can last to 35 years old, the hair of a programmer generally does not last until 35 years old. And the golden age of this decade happens to be the golden decade for girls to give birth. Just imagine that you, 24 years old, graduated with a master's degree and entered a major IT company. It takes at least two years to become an apprentice, and there are nine years left. And if a girl gets married at this golden age, she still has to help boys raise children with housework. How unfriendly to girls, how much energy and brain power do you have to focus on work! Imagine if you are an HR in a company and you see so many bad external factors, would you still consider recruiting girls? The answer is no!Summary: Girls really shouldn't study science and engineering, they are really not friendly to you, unless you are a strong woman!-#100969: https://www.nuswhispers.com/confession/100969","['Haha: 25 people', 'Angry: 21 people', 'Like: 14 people']",84 comments,18 shares
100968,"I was working in NUS for close to 10 years and what I really miss about the University is the honourable NUS President's year-end message to staff and students. Confirm will announce extra holidays one! Like this year, the NUS community is given half a day off on Christmas Eve and 2 days off for New Year's Day on 30 and 31 December. That's on top of the already outrageous 21-day annual leave for staff!But I have to say lahh, not all Profs will allow their staff to fully utilise their annual leave, although it is meant to be an ""entitlement"". I know some really nasty ones who will threaten their staff if they plan to take more than like x number of days of annual leave per year...but that's a story for another post lahh.Ahh, those were the days which will be fondly remembered.-#100968: https://www.nuswhispers.com/confession/100968","['Like: 15 people', 'Love: 3 people', 'Wow: 1 person']",0 Comments,1 share
100966,"We are both investment bankers and bf is 7 years more senior than I am. Over Christmas, he got me a Macbook Air but after an argument where he wanted me to foot his entire $3k hotel bill during our holiday, he billed me for the device. I've always worried about his stinginess. Deal breaker?-#100966: https://www.nuswhispers.com/confession/100966","['Like: 73 people', 'Haha: 70 people', 'Wow: 15 people']",96 comments,19 shares
